id,type,review,date,rating,username,isEdited,title
6786795995,user-reviews,"First of all, I’ve only been using Instagram for around 5 years —maybe less— but I’ve been noticing that update after update, the app has become harder to use, uncreative, and, dare I say, annoying. I don’t exactly understand why the “create post” button was replaced by the reels button; I get that it is probably to promote reels, but there are much better ways to do that, such as put it in the place where the “create post” button is right now, or put it in the drop-down menu in the profile section. I also feel the same way about the heart button moving, because as someone who never uses shopping on Instagram, I would much rather look at who liked my most recent post(s) rather than whatever shopping shows me. Secondly, Instagram needs to stop ripping off other social media apps; I don’t know if this is because it was bought out by Facebook, but Instagram took the biggest details of Snapchat, TikTok, and Facebook, and miraculously managed to find a way to meld them into their app. It’s obvious that Instagram’s company is taking these ideas so people would use their app more, but I feel like people would use the app if it was more unique. To be blunt, Instagram should stop trying to be something else; Instagram should just be Instagram.",2020-12-24T02:43:00Z,3,NeedForMeem101,False,Instagram is Digging its Own Grave
6654471364,user-reviews,"I’ve been having Instagram for personal use for a long time, but since a couple of months ago, things started to go downhill FAST. 
First - Every single promotion I create in my business account says it’s approved, and still is not shown to ONE person. I’ve already checked every single thing that I could be doing wrong, but there’s absolutely nothing wrong. Great quality photo, right size, right content, insta page connected to the Facebook page, you name it. And that would’ve been ok, if it wasn’t for the drastic change in the algorithms, which have been showing my page to its followers every day less and less. The only way to get engagement is by paying them to run ads, and even when you do it, they do not work... such a disappointment! 
Second issue - someone created a fake account of my personal page and HAS BIKINI photos, promising pornographic videos as if it is me, and even though I’ve already reached out to Instagram MULTIPLE times, and have about 100 friends who have reported the fake account, after 2 months ITS STILL THERE! And following every single male in my personal account. The account uses the exact same profile photo & bio as mine, and has blocked me so I can’t see it. — but I can see it through my business account.
Instagram hasn’t responded to any of my attempts to fix things for months.",2020-11-17T07:20:08Z,1,luiza bacetti,False,1- Impersonation problem not addressed for months! 2- TERRIBLE for business accounts!
5972572976,user-reviews,"Just wanted to mention to those who are are concerned , that I stopped using Facebook because of the obtrusive nature of Facebook in the use of my data and exploiting it for purposes that I have not agreed to, nor would I... Instagram seemed like an option that was a platform made for users that enjoyed and appreciated each other’s photos and small bits of commentary versus Facebook‘s rabid feedback loop of everyone including strangers who would be able to comment, and so often disparagingly so, on your content. Instagram at the time, seemed like a mountain lake of peaceful interaction versus the stormy seas that Facebook and it’s deluge of content and ads had become. When I started using Instagram there were no ads pushed onto my feed… Now there are and not just a few, but regularly inserted into my stream that I follow. Some of these ads have products which according to the reviews, could be from companies that are less than reputable… So already it’s begun..Facebook in it’s march to monetize all aspects that it touches is now slowly but surely souring The Instagram platform with it ads and I’m sure eventually with other products that will supplant what Instagram originally was to be about… I will use it until I tire of this which could be sooner than later… We shall see.",2020-05-21T01:53:22Z,3,ballzrog,False,Since Facebook took over I.G.
3584899347,user-reviews,"Instagram is a terrible social media platform with a horrible community with horrible bugs and only makes itself worse. I cannot recommend this app to anyone. I would delete this app in a heartbeat if I didn't talk to so many people on this app. The app tries reinventing itself and only makes itself worse by doing so. The app chooses the remake things that work perfectly on the app and make it over complicated instead of fixing actual infuriating bugs in the app. If you leave the app halfway through a text, the part of the text will show up in the chat every time you open up that conversation for a day or two until it stops for no reason at all. The app also chooses to implement other features that don't need to be added like changes to the profile page and making it more likely to mis-tap and hit a story button when trying to go back from messages than before. It chooses to implement these kinds of features instead of ones I, personally would really like like a feature to read all story's or better privacy. It also infuriates me that they have not chosen to make and iPad app yet. They know they don't need to make this app better because many people have no choice but to use it, like me. Do not get this app and save yourself your own time and brain power trying to understand what they were thinking doing some of the things they do with this app.",2018-12-28T20:20:03Z,1,Gooey penguin30053,False,I cannot recommend this app
4237067995,user-reviews,"Used to be an avid Instagram user, but since the change in post order Instagram doesn’t interest me anymore. I see too many posts that are days old from the same profiles and hardly ever see the profiles I want to, I usually have to go to the users profile to see their posts. I’m also extremely disappointed in the new explore tab, there has to be millions of posts from users out there but I see the same (maybe) 100 posts repeated throughout. I refresh often and try and click as many different photos as i can, and I still end up seeing repeats more repeats than new photos. I originally liked Instagram because of the simplicity in communicating and sharing with friends, but am now realizing I’d rather learn to communicate on another app, it’s not worth being a part of Instagram anymore when it only shows me what it thinks I want to see.😕
ALSO YOU HAVE DELETED SO MANY OF MY FAVORITE PROFILES because they “do not follow” your guidelines when they are not breaking rules. I see celebrities get away with posting nudes and inappropriate pictures everyday like Kim kardashian. I also have several spam nude pages that try to follow and harass me that I have to block and report. Please re-evaluate your guidelines because you are ruining influencers lives when you take their platforms away for breaking no rules. Please start implementing your guidelines on celebrities and stop hurting influencers.",2019-05-30T21:31:47Z,1,julie9610(:,False,Used to be a fan
3901211789,user-reviews,"Instagram has always been my favorite social media app, however, recently I have had VARIOUS problems due to malfunctions within the app. At the beginning of September 2018, I was logged out of my Instagram account for no reason at all. No big deal, I’ll just log myself back in, right? Wrong. Every time I tried to log in it said an error had occurred. I logged into my Instagram through the safari app to make sure my password was correct, and it allowed me to do so. Now knowing that I was using the correct password, I tried again to log into my account through the Instagram app itself. No luck, once again. I contacted Instagram through email and they said there was nothing they could do about the problem. It is now March of 2019 and the problem is still occurring. Instagram needs to fix this situation. Which according to Google, multiple people are facing similar issues as well. Please Instagram, fix these glitches within the app or help the people who are facing these problems. This is a very irritating problem and the Instagram Team just seems to push it to the side. This is not an efficient way to run a company.",2019-03-19T18:10:05Z,5,Brianna Renee S,False,Needs to fix glitches in the app
2011773191,user-reviews,"Okay so I absolutely LOVE Instagram. Recently I have noticed it is not loading all of the posts. I will go on Facebook and see a picture posted that states it is linked with Instagram but never see it on my Instagram feed.  Also when you refresh it will take some of them completely off of the feed instead of putting them towards the bottom.  Can you please fix it! This is causing people to not get any likes at all. My followers say they never see my pictures unless they search my profile. I keep seeing the same pictures over and over again. Some days I get half of the likes I normally do because people do not see my pictures. This is very frustrating. 

Another thing that is annoying is the adds that I don’t ask to see. They are very creepy because they relate to the things that I like but that’s not why I got instagram. It seems like this app is trying to copy every other social media app such as Snapchat and Facebook. 

I have been having this issues about loading pictures and my followers not seeing my stuff for about a year now. Can we please go back to the old instagram where everything was in chronological order?",2017-12-20T13:05:32Z,5,Megan3133,False,Fix in update
3676406365,user-reviews,"I it enjoy Instagram, it is my favorite social  media app.  I love looking at other people's pictures and staying in touch with family members that are away.  It is a source for a lot of my creative inspiration and I love that aspect.  All the new tools that Instagram has incorporated into its app are so amazing and helpful. I look forward to the new features that they will one day include in the future.  One that I hope they include is the ability it add/edit postures once they have been uploaded.  This is something that I struggle with all the time, whenever I'm posting multiple pictures at a time using their sliding picture format, I cannot add onto, delete, or rearrange the order of these photos. I recently just uploaded a pair of two pictures to my page only later to realize that I forgot to add a third photo that I was planning to put.  I think it would be helpful if Instagram added an option to edit pictures in such a way that we are permitted to edit captions.  I do not wish to delete the whole post, but to simply add one more photo to my post.  Instagram please listen to this message for it will help my and several of my other friends who struggle with this same issue!",2019-01-21T06:24:12Z,4,The name is Bella,False,It's good but I have some suggestion
6381711223,user-reviews,"Hello! As an artist, Instagram has been a great way of reaching out as a creative to other creatives, and see a regular stream of artist’s content on my feed.

Unfortunately, with each update, I’ve been having a harder and harder time both reaching out and seeing other people’s posts. Especially with the latest one — now, my main feed cuts off at all unread posts, and gives me a curated stream of recommended posts, which isn’t what I look for on my main feed. I’m looking for the people I actually follow and want to see content of, even if it’s old content! Old posts are now on a separate page that I can only find if I reach the end of my unread feed, and they’re not even sorted by time posted. Popularity-based algorithms that try to predict what I want to see inevitably make it harder for small creatives to reach out to their communities, and only make viewers have even easier access to accounts that already are popular.

I greatly enjoy using Instagram, as a creative and as a user, because of the easy access to a feed of other artists that I am already following — I don’t have this easy access anymore. If I’m going to look for other accounts, I would rather it be on a different tab, not shoved in my face while I’m on my main feed.",2020-08-31T19:58:53Z,3,fallingwish,False,Main Feed Now Cluttered
4400041114,user-reviews,"I installed Instagram because the app said you needed to be 12. I had it for a few months and eventually my posts totaled to about 80. I had taken pictures of holidays, trips, vacations, my family, and my dog. For a while, everything was fine and I loved the app, but then I made another slime account. I made this account and started using both of them. After a few days, I was asked to put in my age for some reason on my first account. The one with all my memories. I put it in and the age said I was 12. I then had to try to put in my age a few more times, but I put the same age in. I then was forced off of my first account. I clicked the button to save my pictures, but it didn’t work. I was so confused because the app said I needed to be 12, but I got an email saying I  had to be thirteen. The app said YOU NEED TO BE 12 NOT 13!!!  I was so mad and upset. All of my memories were gone and I couldn’t recover my photos.  This needs to be fixed and I want my photos back. 
Another problem with the app is that you can’t have more than 1 account with one email. I had to start using my family’s email with their permission so I could have 2 accounts. I don’t understand why you can’t have 2 accounts on one email. If o want 10 accounts, I will need 10 emails. That absurd. Can I pox’s have an explanation on this.",2019-07-02T08:23:04Z,2,Eyera101,False,"Great, but turned out horrible! 😯😡"
3590764858,user-reviews,"They will delete your account without any warning and it doesn’t matter if your content is good or bad. They don’t care how their users feel about the new algorithm updates. Don’t bother trying to make a complaint, no one will respond. Your content gets restricted or shadow banned depending on what you post or what hashtags you use. If you’re a conservative, don’t bother using this bias platform to voice your opinions, they will shut you down. You’ll see the same 20 people on your timeline regardless of how many 1000s you follow. Advertising is everywhere and can’t be avoided! Don’t post often? Consider your account deleted for not using it. The new algorithm makes you interact more with followers so that your content is seen but yet my likes continue to drop and more of my longtime followers have unfollowed me. When I message them to ask why they all said they didn’t unfollow me and thought I did. So not only does Instagram restrict accounts they don’t like or consider popular but will also remove some of your most active followers to keep your content from being seen. They act as if they are too good to be true but are really setting themselves up to less than MySpace in a few years.

I really suggest switching to Vero The True Social App! Been there a few months and I love it. Plus, they aren’t as strict as Instagram and you see content from all the people you follow.",2018-12-30T08:39:55Z,1,MissV_3,False,Instagram is a bully
2974262322,user-reviews,"You guys need to start listening to your users. Everything on here is just so messed up, the whole algorithm thing is annoying, and the feed/comments should be in chronological order. I don’t want to see someone’s post from two weeks ago I want to see the posts that were posted an hour or two ago. Also it isn’t fair that only certain story stickers are available to everyone. Yes I get that when you release things to the public it take time for everyone to get it so that’s understandable but when only some stickers are released to certain people that’s when it becomes unfair. I want to be able to add links to my stories but I can’t because it’s not released to everyone or not everyone has gotten the update yet. Also some lgbtq+ post have been taken down and honestly that’s just not right what is so wrong with lgbtq+ is it effecting anyone personally? No, no it’s not. Also being a depression help account on instagram I find it really rude that you take down posts that talk about depression/anxiety/self harm, then give people lousy websites that that so called ‘help people’ with that stuff. Just leave the posts up so someone can hopefully find the post and give/get the person that posted it needed help that will actually help them. Instagram please just start listening to your users or Instagram is just going to become as dead as Facebook.",2018-07-26T22:49:33Z,1,Rae Knight,False,Honestly this is getting annoying
1992936432,user-reviews,"While I enjoy this app, I've been using it for 3 years, there are some recent issues that have been bothering me. All the updates have just been going downhill since the chronological order of your feed was removed. My feed is a mess of the same people over and over again with posts from many days ago because instagram thinks I want to see that stuff above everything else. The ""solution"" was to help you stay up to date with the posts you miss, but now I am missing more posts in my feed than before because of this system. I recommend making it an option in settings to turn on chronological order of your feed, it would make things so much easier. Another issue I have is that I recently noticed that the accounts you follow are no longer in chronological order either? There seems to be no organized way they are put in order, it's just like it was randomly thrown in there like that. This proves to be very difficult for me to find accounts I have recently followed as they no longer show up at the top of my followed box. I am following over 1,600 accounts so I have a very hard time remembering the name of an account I just followed. I just wanted to find one account and now it's lost in the many accounts I follow. Please make these changes, it would make the app so much easier to use.",2017-12-13T11:06:39Z,2,Imsteved,False,Some issues
6657149799,user-reviews,"Instagram replaced the notification tap with the shopping tab, and the posting tab with the reel tab. It’s trying to be a ripoff tiktok and it’s more than irritating. Every update makes the layout more atrocious. 
A lot of people don’t even shop on instagram like that, and god forbid you accidentally press on post that’s promoting a product that you’re not in to remotely, instagram will never forget and just keep and keep promoting it and things like it to you, even if you click “not interested”. 
Having the reels feature be on the explore tab was perfectly fine, there’s no need to have an entire tab for it, ESPECIALLY TO REPLACE THE POSTING TAB? The reel tab doesn’t even show you things based off who you follow sometimes, sometimes I literally get recommended 7 year old’s tiktoks and it’s so weird. I never get recommended a small account of something i’m into, it’s always a random child or middle schooler and it weirds me out. 
Notifications should always be more accessible than the shopping tab, I understand that a lot of people buy things off of tiktok, but that’s what tiktok is for, if they’re buying those things off tiktok they’re not going to think “what if they have the same product on instagram?” They’re just going to buy it off tiktok. All the people on instagram who don’t use tiktok are now being force fed it against their will and it’s just horrible",2020-11-18T00:14:50Z,1,mijkachi,False,New update is horrible
5903954677,user-reviews,"One day Instagram randomly logged me out of my account. I tried to log back in and all I get is “ sorry there is a problem with your request”. It has been like that for over a week. My account is not banned because I can log in on other peoples phones and I can even log in on my own phone under the google chrome browser. It’s clearly a problem with the app. I even had my brother try to login to his account on my app and it won’t even let him in and there is nothing wrong with his account. I have tried redownloading the app, turning my phone on and off, and even resetting my whole phone and nothing has helped. I have reached out to Instagram for help and no has responded and based on things I’ve read they never will. The lack of tech support for one of the biggest apps on the market is incredibly stupid. I have done research and there is several hundreds if not thousands of people dealing with this same issue and have been for years and are still stuck and Instagram refuses to look into it or respond to anyone and help them. It’s disgusting. I have come to the conclusion I will never be able to use this app again until Instagram decides to join the 21st century and actually have a tech support team where you can actually talk to someone about your app problems. It’s 2020, I cannot believe I have to deal with this.",2020-05-05T01:29:43Z,1,Alex5lamar,False,Not banned but can’t login- No one at IG seems to care
3755523579,user-reviews,"So, Instagram is like pretty great, it’s my favorite social media platform. However I wish that the creators could make a few improvements and adjustments. 
First of all, I know that there’s a highlights section for your stories, but I wish there could be a folder to combine posts. For example, I have a drawing account and it would be nice if I could have a place in my account where I could combine posts from past months. D’ya know what I mean? I tried to screenshot all the posts from the past month, but it was just too much work. 
My second point is about stories. I know that y’all have added polls and “type something” features. What if you added another feature like those two but the responses were anonymous to the person who posted the story. Sometimes I wanna respond to one of my friends, but I feel embarrassed or insecure about my answer. This feature is not a necessity, nor a need, but it would attract a lot of attention to the youth, like me. Anyway, I believe that these pieces of feedback will liven up the app. Hopefully y’all add at least one of these in. Sorry for the long post, I had a lot to say, obviously.",2019-02-10T21:56:06Z,5,a non-basic teen,False,Feedback and suggestions improvements
5358318589,user-reviews,"I have reported a problem of mine regarding my inbox not working multiple times over the PAST 4 MONTHS SINCE I HAD STRATED HAVING THIS PROBLEM. They have had i believe 2 updates since and yet STILL the problem has not been fixed. My app is up to date and the device I am using is an iphone 8+ with an ios that is also currently up to date. Whenever I check my dm inbox, nothing pops up like no conversations or group chats, although I have had conversations with other before. Nothing shows, and the only way I could pull up my dm’s with another person is to create a new message and select the person’s name. After exiting, the person’s @ is the only thing that shows up on screen and no one else’s. I’ve refreshed it multiple times but to no avail. In addition, everytime I exit instagram or go onto a different account, my inbox goes back to being empty as if I had never sent anyone a message before. This has not been an issue in any other account that I log in to. I have also searched for solutions on the internet and YES, there is quite a handful people on the internet who also are currently experiencing this problem and according to one of them, they have had this problem for around 4 months as well. Instagram has done NOTHING to solve it, although there are many people who are evidently experiencing the same difficulty.",2020-01-04T05:01:49Z,1,Peculiar Asian Guy,False,Ya’ll have GOT to have the world’s worst customer service
3851261057,user-reviews,"I’ve been using Instagram since 2011 and these past couple years and months the changes are making it so horrible I don’t even want to use it anymore. Can’t see who viewed past stories, EVERYONE WANTS CHRONOLOGICAL ORDER BACK, randomly follows and unfollows accounts without permission, some people who I follow I never ever see their posts, they censor/delete so much art and posts that don’t violate the guidelines, yet they allow accounts and posts harassing and bullying others to stay up after they’re reported, now they’re pushing sponsoring posts so much that if you don’t pay $$$$ barely anyone following you sees it, because of them handing out “credit” to everyone every 2-3 posts on my feed is a sponsored post from someone I AM not following and doesn’t post anything relevant to what I’m interested in or frequently like, every 4-5 posts there’s an ad, ITS SPAM!!!!!! CONSTANTLY!!! in between stories there’s tons of ads, and they’re STILL making it so their users have to pay for their audience to even see their posts, asking us for more money as if they’re not making enough off many many ads. It’s exhausting, I’m so sick of thing I don’t care about being shoved in my face when I’m trying to keep up with artists, businesses & people I love. I can’t wait for a better app to come out because once it does ima delete this forever, maybe even before then. I’ve had it.",2019-03-07T02:06:13Z,1,televisioneheaven,False,Just gets worse and worse
