id,type,review,date,rating,username,isEdited,title
3974971553,user-reviews,"I love Instagram and it helps me explore and find new things and communities but I don’t like that if someone follows me and if I follow back, they can automatically start a chat with me. With out giving me the option to click accept or decline. It’s bother some following a page I like but then the person starts to spam my messages without having me “Accept” them. On that note: I would love a “stop chatting” option. I accidentally clicked the accept button when cleaning my screen for someone and they keep messaging me non stop even after I told them I wish to no longer chat with them, and after I explained that I accepted them by mistake, they keep chatting with me. I don’t like how I have asked many people and they all told me that my only option is to block the person. I find that extreme to block someone over me accidentally clicking “Accept”. 

I would love those two things: 
•No automatic “Accept” to chats when both people follow each other 
•A “stop chatting” button so you can stop talking to people and you’ll have to Accept or Decline them all over again. (It’ll be great if it kept the chats also just in case of anything)",2019-04-06T01:13:44Z,5,Pinkrose1422,False,Accept and stop chatting
3580133335,user-reviews,"I’ve had Instagram for over three years, and as time has moved on, the app got worse, I run an account that used to get over 100,000 views per post, but now that they changed the algorithms to benefit only advertisers (a very sneaky and Miley hungry move, like Facebook does) my posts will rarely get more than 5,000 views. Hundreds of other accounts and I work to make our posts show up on the explore page and build a community, but now all you can find on the explored page are irrelevant posts and ads. Also, I’m pretty sure everyone on Instagram had been begging for a chronological feed as long as Instagram has existed. Well we got an update to our feeds, but definitely not what we were hoping for. The December 27th update where you swipe sideways like a story to see your feed may have just ruined Instagram. It is so inconvenient to access the explore page, switch accounts, go to your profile, and post on your story. You can’t tap or swipe to switch stories without accidentally pulling up random stats you really don’t need to see, and it’s very difficult to do one handed, which is one of the things that made Instagram so easy and accessible. I know this update is taking me off Instagram, and I’m sure I’m not the only one leaving for good. Please Instagram, actually listen to your users when making an update and don’t pretend this is what we want.",2018-12-27T15:51:16Z,1,Just Advice,False,It’s not worth bothering anymore
3095229548,user-reviews,"i’m sure instagram knows by now that a lot of people use their platform to share edits. there’s lots of editing accounts on instagram (i have 3). but as editors, we have lots of problems with your app. i’ll start with the biggest one, the percentage thing. where it says “this post is doing 80% better than your other posts.” since editors have gotten the instagram update, our views/likes have gone wayyyy down. and we believe it’s something to do with the rule that only a small percentage of our followers can see our posts. that is just so unfair. we spend hours/days at a time working on edits. they’re not easy to make. but we do it because we love to edit & we want to make our followers happy. editors work their butts off and deserve more than 5% or 7% of their followers to see them. problem 2. instagram quality. when we export our edits they’re in good quality. but when we post them the quality just goes down? that’s a huge letdown when you spend hours on an edit, just to post it and it has bad quality. problem 3. only 5 accounts? if anything there should be unlimited accounts. other editors & i probably want to create more than 5 accounts, because we like to edit more than 5 people! instagram, your app used to be a very good platform for editors, but you honestly need to fix your stuff. 
-L",2018-08-21T13:23:02Z,2,editingaverg,False,instagram editors
5884074990,user-reviews,"Instagram as a whole ever since I got it last summer has a been a great experience for me. I’ve been able to connect with my friends faster than I would’ve without it, and it’s a good thing to have when I’m bored and have nothing else to do. However, after having Instagram for many months I have discovered a couple of issues that are driving me nuts. First, on the home page once every so often the several most recent posts get mixed up in a seemingly RANDOM ORDER. I don’t like this at all because the post that gets moved to the top is most likely a post that I don’t want to see again for a while, like today that post is one that I don’t like at all and would rather not see AGAIN, and also because I someone who likes his home page posts to be precisely in CHRONOLOGICAL ORDER. Second, when an Instagram update comes around, the caption for it should say more than just fixing bugs and issues on Instagram, like what exactly that update is going to do with certain pages on the app and why. Please take the time to deal with these issues that I’ve stated above so that in the near future I’ll be able to confidently give Instagram a FIVE STAR RATING instead of a four star rating.",2020-04-30T14:04:53Z,4,bronze9,False,"Great, but needs some issues fixed."
3877793663,user-reviews,"Instagram is a great creative app where I can stay in touch with friends and family. Posting my own photos I get to be creative, too. I have noticed though I seem to go through a lot of issues when using the app. 

I had been hacked and reported it immediately. When I got emails back on telling me what to do next, I knew they weren’t actually people just machines already programmed which made is much more frustrating. Instead of getting my account back they disabled it completely and I had to make a new one. Then once I made the new one after a while it would not let me log onto or make a new account with the phone I had. It allowed me to do this when I received my new iPhone.

Now I’m having issues just simply logging into my account AGAIN. It consistently says “we’re sorry, an error has occurred”. I have good WiFi and the strongest connection to internet I can get, even if I were on wife my cellular data is pretty good about being just as smooth like WiFi. I reported a problem, but there’s no actually person to communicate with which is just frustrating all over again and makes me feel like I’m running in CIRCLES. If instagram improved their support system then I believe no problems would ever occur to being with on the app....",2019-03-13T20:27:19Z,3,JayBird3571,False,Instagram personally
6713733542,user-reviews,"Please hear me out Instagram because apparently you don’t deem your users worthy of your time. I’ve been blocked from commenting, liking, and requesting to follow for weeks now. Why? Apparently an algorithm considered me to be spam. Seriously? You block me from doing virtually anything on the app. And this go beyond just my interactions with other posts because I’ve been having issues uploading on my stories and I can’t even comment or like my own posts nor others which I’m tagged on. I’ve tried logging out and back in, uninstalling and reinstalling, and still no resolve. I’d like to know what the process is when you report issues because I’ve been sending out reports at least once a week for almost a month and I still haven’t heard back. Do you even check the reports? Was I reported as a spam account? What procedures are in place to verify a spam account? Why was I not a part of any of this? I don’t use Facebook, I don’t have Twitter, I don’t have Tik Tok, so Instagram has always been my favorite social media account but at this point I’m seriously considering shutting it down for good since I can’t even use it anymore. The only thing left that I hadn’t done up until this point is give a bad review and I’m torn about doing this because I understand everyone has a job and bugs happen, but this has drug on for too long. Fix this.",2020-12-03T18:24:26Z,1,jmvasq03,False,Never thought I would have to do this
3760170239,user-reviews,"I can’t translate posts in a different language after this new update... which is annoying because how can I understand posts of friends in different countries who don’t speak the same language as me? I cant copy and paste the caption into google translate so there’s no way to understand what they’re saying. Please fix this, thanks.
Also, literally everyone wants you to switch back to chronological posts. Why don’t you listen to your users? The algorithms are so dumb, I’ve stopped seeing posts for some of my favorite accounts lately just because the algorithm doesn’t think I’ll like them. I’ll go find the account with posts that don’t show up in my feed and purposefully like and comment on all of their recent pictures, but still some posts from my favorite accounts don’t ever show up in my feed even if they post ALL the time. If I want to make sure I don’t miss certain posts then I turn on post notifications. But this algorithm is hella annoying and I miss when Instagram had the chronological feed. I know most everyone agrees with me, I mean cmon Instagram, it’s painfully obvious. At some point some other social media app is going to come along and you’ll be as irrelevant as Facebook. So why not try to please your users as best as you can instead of more and more people taking a break from insta??? Just asking the real questions here",2019-02-12T04:21:30Z,1,Autumn Capurso,False,Missing “see translation” button
3059690167,user-reviews,"I recently got into taking photos and one of the best ways to quickly share my images with others is Instagram. I can also connect with other great photographers and it has helped expand my perspective on the art. This is invaluable to me. However, recently my feed has utterly ceased to show me pics from people who i follow and like the most. The more popular a profile is, the more it shows up, so that, for example, i just began to see 10+ nat geo posts at a time in a few minutes even though i hit like on a lot of other images from other people. So i had no choice but to unfollow the nat geo profiles, which i did not have to do a few months ago. As for the people i know irl and like every single one of their posts, i no longer get any notification of their posts, and i may or may not even see it on my feed until it is a day old or more. I dont even care about the ads, they are actually targeted towards me very well. I am currently considering other platforms to share my images but unfortunately this is the most well known. Once a good one pops up it will be my pleasure to switch. Sorry IG, but its very clear that you do not value me as a user whatsoever. In reality you will not look at this review at all.",2018-08-13T17:49:06Z,3,buddy Walrus,False,IG dared to sideline posts from my actual friends.
6788915630,user-reviews,"Usually I love this app however ever since the few recent updates there are so many bugs. I don't mind the new layout changes as I can adapt, but as far as the bugs on this app - that I don't enjoy. Everytime I like a photo/post, it automatically unlikes immediately after (I have to retap the post a couple more times which can be annoying). The biggest issue for me now is I just got a brand new iPhone 12 Pro Max and the app completely refuses to show me push notifications. I've updated the phone settings multiple times and even changed the push notification settings within the Instagram app itself. No matter what I do, notifications just won't work. It's very annoying especially because this is a new phone and the previous issue I stated earlier (automatically unliking posts as soon as I tap the heart icon) persists on my brand new iPhone. Videos also pause about 5 seconds in, almost everytime I'm viewing a video it freezes. Looks like these problems are shared among many people as well, you'd think Instagram would fix it by now. Like I said I do enjoy this app and it allows me to do many things, but recently the app has just been so buggy it's unfortunate. I hope it gets resolved soon!",2020-12-24T16:33:00Z,3,Steeeveenn86,False,Love the app but way too many bugs now
4485642607,user-reviews,"Although I love Instagram when it works, it’s annoying when they reset the explore page and flush all your custom “for you” feed to random photography that I couldn’t care less about. I mainly go on Instagram to look at my explore page feed when I’m bored, but when it resets I can’t do that. Another problem is that Instagram has logged me out of multiple accounts for no reason, causing me to have to start a new account and lose everything on my other accounts. I know this is instagrams fault as I have never given my password to anyone (online or real life) therefore, couldn’t have been hacked. I’ve also recently been “banned” from liking posts for two days, which dosent make sense because the pop up said that it was do to “my previous use of the feature.” I like completely normal content and had no reason to banned. I know I’m not the only one experiencing problems either, Instagram always shuts down and doesn’t load, and not because of WiFi, everyone on the app complained at one point and it became a thing where everyone flooded to twitter. They to fix their issues because I’m getting tired of having problems with the app. Other than these reoccurring inconveniences, I like the app when it’s working.",2019-07-19T13:52:02Z,3,16brohar20,False,Good when it’s working.
5297998602,user-reviews,"For starters, I don’t want “instagram - from the company that sold your data to Russians in an attempt to win the 2016 presidential election” (Muller report concluded this; So did Ocasio-Cortez’s questioning of Zuckerberg). Considering Instagrams heavy youth use, and the prevalence of being against corruption, this distance would be an obvious marketing point. I think one of the main reasons people use Instagram is because they prefer that diversity between apps; even though it’s owned by Facebook. Not to mention the fact that now, the DM’s look scarily similar to messenger. I have to ask exactly why? Users prefer differences between their apps. If they wanted a messenger-like experience, they’d get messenger. I’d greatly appreciate the app to not lose a significant amount of user support. Also, the algorithm has consistently failed us. If you could address and correct these problems before they become even more of an issue, that would be great. Facebook to most Instagram users, it leads a feeling of uncertainty and mistrust. Our data was sold to a foreign nation. That’s unacceptable. So saying “Instagram- from Facebook” while making substantial changes to the app; it’s quite concerning. The app was amazing before. Now? No. Not at all. If this wouldn’t have happened, you’d have five stars. Zuckerberg has destroyed facebooks reputation. It’s not too late for Instagram... yet.",2019-12-21T02:59:50Z,1,#Jakeisswag,False,Updates? No. Stop making unnecessary “improvements.”
6641309631,user-reviews,"This app used to be perfect for what it is, but now there are several things about it that are kind of ruining the app for me and making everything so much worse. First of all, reels. I wouldn’t mind reels as much if they had their own dedicated tab off to the side, but I don’t like the fact that I heard on the explore page. I can’t even look at memes around other people anymore without a stupid stripper appearing on my screen. You guys should really start blocking posts like that from showing up, there are little kids who go on this app. I get why you guys created reels, but they should not be in the explore page if they’re in the app. It makes scrolling through memes VERY uncomfortable. Also, I like how Instagram used to tell me when I’ve seen all my followers’ posts for the past two days. However, I do NOT like that I have to manually select an option in order to view older posts. It makes it a lot harder to find something funny I’ve seen earlier, or like a friend’s photo that I saw earlier put scrolled past. It’s a lot more useful than just having a bunch of random posts from accounts I’m not going to follow below the stuff on my feed. All in all, I like this app fine, there’s just some flaws that NEED to be fixed.",2020-11-13T18:40:42Z,3,joe_mama_vevo,False,Has noticeably declined.
4004881183,user-reviews,"Instagram has been completely messed up for me the past few days. The biggest problem is, every time I click on a notification (from within the app or from a push notification) it only opens the comment section on that post, not the actual post. So I will click on the notification, it shows me a bunch of comments, but there’s no way to see the post itself; I’ll forget what the notification is and never end up seeing the post. Even clicking on my own post from notifications if someone likes it does the same thing. Another thing is I keep getting notifications from the same post, sometimes hours later. Also, another horrible problem is if somebody sends me a post from a private account that I don’t follow, and then I start following that account, even after I get approved it still says in the dms “this is a private account follow them to see this message” so I don’t know what post was sent to me. Gets super annoying. Lastly, this one isn’t a huge deal but it still a weird glitch: sometimes when I open a video somebody sent in dms (from camera roll, not a post) the sound from that will keep playing on Instagram. Leaving the app and coming back doesn’t stop it, the only thing that stops it is closing the app in multitasking. Hope you guys are working on these issues, thanks",2019-04-12T23:52:21Z,2,auoso y ucucuuchalwfou,False,Broken
3580084033,user-reviews,"First of all...it’s 2018 and you still don’t have a native iPad app, which is frankly awful but now you’ve replaced the most natural gesture of scrolling with a horizontal tap which seems quicker but makes it much harder to scroll back up to thinks you’ve already passed and much harder to keep a sense of chronology (which you also removed) 
Honestly the changes you’ve been making make me not want to use the app anymore, some new features are nice but some are a complete failure. Horizontal scrolling works fine for stories but making stories and posts feel like the same thing is dumb and you still have to scroll vertically when you go to someone’s grid so why make the app feel even more disjointed?  Now you essentially have four different interfaces, one for ig tv, one for user pages and discover, another for stories and a slightly different one now for the home and they all function differently.

It honestly feels like you haven’t tested this because across the app people are complaining and also, for users who make posts with multiple images, it’s a nightmare because you already use horizontal scrolling for that but now you have to be careful not to tap the wrong part or you’ll scroll past the post or be stuck on the post when you intended to do something else. This update is a total mess.",2018-12-27T15:39:34Z,1,Quuaaack,False,New horizontal layout is awful and crashes my iPad Pro 2018
2300721319,user-reviews,"I own a photography business and have a business Instagram account which I love as it shows insights and engagement. This tool has helped me tailor and grow my following to close to 2,000 people. However, I had noticed a dramatic reduction in the amount of “likes” and “engagement” on my posts. Before the new update, I would receive around 300 likes with 1,500 people seeing my post and now I’m lucky to get 150 “likes” and 600 people seeing my posts. This is frustrating as it’s completely stunted my growth as a business and I’m helpless to do anything about it, even when I post at peak times. One of my peers had mentioned to me that the app now judges the percentage of followers that “like” your post within the first 10 minutes of you posting to determine how many of your followers will be shown your post. This has hurt me a lot as my posts now don’t get enough engagement to make it on discover pages or show up at the “top” of locations when I tag them. Not everyone uses Instagram everyday and if your following isn’t composed of hyperactive users, your posts will get completely pushed aside and buried. Please fix your algorithm so I can continue to grow my business and portfolio. I love Instagram and this app has been a huge benefit to reaching more consumers, please change it back, thank you.",2018-03-13T06:23:31Z,2,leahg726,False,The New Algorithm is Worse
2831440098,user-reviews,"So one day I was peacefully scrolling through Instagram and I thought I should watch stories , so I go up to the top and the stories are all gone . So I thought “ oh it’s probably just a one time thing , I will just close the app and try again “ so I got back on and what do you know the stupid stories still aren’t there . Then I decided to look it up on google and apparently it is a very common problem and there is no known fix for it , so I decided maybe I should just delete the app and re-install it . So I deleted it and went on the App Store and searched up Instagram and it was gone , so I changed the filter to “iPhone only ” STILL didn’t show up . So at this point I was very upset , and I couldn’t think of what to do then finally it hit me , I should look on my purchased app history . So I looked up “ Instagram ”
And what do I get in response “ NO RESULTS this is not an app you have ” and I was just thinking really because if I recall I had it less than a minute ago . So I just searched up Instagram again and I saw this app that said “where your kids are hanging out” so I pressed on that and I scrolled down and it said suggested apps “Instagram” and “Snapchat ” , so I am very confused why Instagram decided to take away all of the stories from me , and then try to hide the app or something ???? So I am just very confused and they definitely need to figure something out and FAST!!!",2018-07-04T02:37:48Z,1,annabelle keasling,False,I am mad
6556119820,user-reviews,"Instagram is supposed to be safe for what? Age 12 and up, right? Well it’s not. There are plenty of inappropriate accounts and sexual nudity which Instagram doesn’t remove. Instagram favors accounts with followers. Smaller accounts with nudes can be removed, but when it’s an account with 20k or more, they do nothing. So if you are a minor or a younger child, be careful. There are a lot of inappropriate images that when scrolling through insta will pop up. It’s not ur fault if they pop up either, it’s not like I search around for these accounts! Instagram isn’t safe for younger people. Really disappointed in you instagram👎🏻 I literally just saw an account come up with a post of the woman in bed completely naked(nothing on at all) in a sexual pose with just her nipples covered by the way she was laying on the covers. It makes me furious seeing posts like that, knowing that there are young boys on the app who are going to end up falling into a sexual fantasy. Even if that wasn’t an issue, the fact that that is allowed on the app is absurd and outright inappropriate. Our culture today is a mess! If you are a parent viewing this, I recommend you child to have a private account that you keep an eye on.  I personally enjoy posting on my account and keeping track of social events that happen in my life, but there is so much inappropriate posts that I come across all the time.",2020-10-20T19:19:54Z,1,KarisLovesAnime,False,You lost my respect
3882074955,user-reviews,I don’t know where this review is going to And who’s going to be reading it but it said if I wanted to write a review and I never write a review for anything. But I must say Instagram Revolutionized my life. Obviously it was me that did most of the work but the networking which clearly be significantly different if it wasn’t for social media platform like Instagram. I do tattoos for a living and all of my clientele comes from people who email me after seeing my page of Instagram . People from all mover the world get to see my work and know who I am . Instagram came out when I started tattooing and what a blessing that was .I've been able to network with other artists and announce to public when I’d be in different states doing a guest appearance at other shops . It’s important not to get obsessed with your like and followers but they should also keep you motivated to keep leveling up in whatever your presenting on Instagram .  But anyway I just wanted to say a few years ago I decided to turn everything around in my life and when it came to getting into the tattoo industry Instagram had a huge impact on how I network my craft .,2019-03-15T00:25:24Z,5,hhggggggggguihy,False,Instagram helped make my career
