id,type,review,date,rating,username,isEdited,title
2106581364,user-reviews,I was just on an NFL post about the Jaguars defensive stats having a plain old argument that even though the Steele’s lost that doesn’t make the Jags a better team... that has nothing to do with my problem. The problem is I typed a response to a commenter during the argument of which I was blocked from posting saying that Instagram keeps certain “guidelines” for the community... some generic message I’d expect if i was trying to say something racist or sexist. But no. It was a simple argument about football that I was blocked from expressing my opinion on because it didn’t follow “guidelines”. The comment had no vulgar language and presented my argument in such a way that there was no degrading or demeaning connotation toward the would be recipient. TAKE NOTE: This comment was made on an NFL post and I was blocked from posting my opinion AGAINST the team the post was promoting.  This is not a singular or first occurrence as I’ve had this problem before with Instagram blocking me from posting comments that oppose the view(s) expresses within the correlating post.  I quite frankly find this ridiculous amongst the sea of comments I read through on posts from news publications such as Fox.  As long as you don’t disagree with the post you can same just about anything that isn’t immediately racist or sexist... but I can’t argue about football.  Fix this.,2018-01-20T03:38:08Z,2,Poor people love Jesus,False,Instagram discriminated against who can post what in the comments.
6238205773,user-reviews,"I have never made a review on something before. I absolutely loved insta it’s a mix between snap chat and I can also shop on it and I’ve found many small good businesses which is awesome, but I just deleted the app, because I have been dealing with hate, death threats, and harassment from an account run by 3 people. I clearly understand this happens on any social media platform but I’ve noticed it more on here. I reported them when they first started doing it after I stated my opinion on something they came into my dms and started mocking me so I had to make my acc private. Then they posted parts of the dm where I was clearly defending myself, I said nothing rude never harassed them back just simply stated why I believe what I do. Yes I know you can’t do much about it when it’s in the dms but when they publicly harass me and you can see their post that’s wrong. I then blocked the account and ignored it, but they all 3 made new fake accounts and did the same thing. I have been blocking all these accounts for about a month and can’t handle it anymore. I have reported their main account and get told we all have different views but pretty sure death threats isn’t something that should
be viewed had following community guide line. Instagram please stop worrying so much about the layout and fix the harassment and mockery on Instagram because I know it’s not just me that gets it.",2020-07-25T01:04:56Z,2,1phone 6 please,False,Fix it please
4141928134,user-reviews,"Honestly. If you would’ve asked me a little over a week ago I would’ve said, “ I love Instagram it’s the best social media app out there!” But , within this lovely week-ish. I’ve had my business account completely deleted with no explanation. Let’s add that it was AFTER I paid for a Instagram promotion and finished it. So they took my money, then deleted my account. I didn’t post anything more from the post that I put through promotion, just took the money and deleted it. And now after giving up on having my business go through Instagram I find today that I’ve also been logged out of my personal account, not deleted yet, but the account that I’ve had since I was in 6th grade. The account will not let me log in since I had an account that got blocked on this phone. So now I’m off of both business and personal accounts and being forced by Instagram to take an ig hiatus. I don’t understand why Instagram is targeting certain accounts through their apps, especially account holders that are physically paying them. So, please take a second to think about weather it’s worth it to run a business through Instagram with having the chance for it to be deleted with no exploration and no support from Instagram since none of their support outlets either connect you with someone or even work for what they say they do. Thanks for reading my annoyed ramble. I’m gonna go see if you can run a business through Twitter now.",2019-05-13T02:37:12Z,1,DaintlyDelilah,False,Oh Instagram.
2106946537,user-reviews,"I’ve been an Instagram user for a long time now and I really enjoy the app. Definitely my favorite social media platform. I, unlike most, really like Instagram stories and I love how you can save stuff without having to screenshot. My complaint however is my home feed. I’m tired of only seeing posts from 5 of the 200 people I follow. I wish there was a way to have it be in chronological order, but you can make it so that specific people do show up at the top of your feed. This may sound a little silly but it’s pretty embarrassing when you accidentally like and comment on a post from 5 days ago as if it was posted ten minutes ago. Really I don’t understand why Instagram is making all these frankly useless updates to the algorithm. Instead of that they should be cracking down on how the thumbnail (starter photo?) for a video has nothing to do with the video. Now that’s something that needs worked on. I feel that these algorithm changes only benefit the people exploiting Instagram and hurts regular users content intake. This is a little long so in short great app but please stop messing with my feed, or at least give me the option to change it back to the way it was if I so please.",2018-01-20T06:06:31Z,5,falloutjane,False,Algorithm
4126899264,user-reviews,"I know you guys don’t read these but I’ll write this anyway. Why the feed isn’t in chronological order is beyond idiotic at this point. No one needs the espn highlights from 3 days ago at the top of the feed list. Then as a fellow developer and finance manager of a company, I know facebook inc sells data to other tech company’s so they can find “look a likes” and such to target their markets better. But you guys have made it so obvious that you are just hoarding your users data to sell to the anyone willing to pay your prices. Like if someone tags a location in playa vista California, and the very next day gets sponsored ads in their feed for Apt’s in playa vista california. Hey cool it’s a business and you guys are great at it because the idea of your product is amazing. But every time one of these algorithm based add ins are included into your development the greatness of your product deteriorates. I deleted Facebook years ago because long before your political troubles it was glaringly obvious that the spirit of your product was dead. Facebook was no longer the cool party. Instagram is doing the same thing. At least give your users the option to choose. Most wont even care if they were given a choice (yes that was a matrix reference). But when most people speak of how gross social media can be. It’s not the users or content it’s how you guys choose to display it. I hope that you all could really do better because now it’s kinda trash.",2019-05-10T05:18:38Z,1,TCHALLA21,False,Not good
3556128131,user-reviews,"I’ve had Instagram since 2013, which is a very long time 😂 It’s definitely changed over the years. A few problems I’m facing now, however, include my explore page resetting (I’d have to exit the app & go back in to fix that), and not having sound when I try to upload a video on an extra account.
I also feel that a few of the features that used to be on there were so much better and easier to get to.
Archived Stories, for example. Whenever your story would disappear after the 24 hours ended, you’d get a notification saying how many people viewed it. Now, that’s not there anymore, and I have to go to my archived just to see who looked at my stories.
 Another thing is the hashtag following (or whatever it is 🤷‍♀️). For me personally, I’ve never used this. I tried it once and just thought it was annoying cause the posts would go on my feed, and I’d be thinking that I’m just following these accounts when I wasn’t. It really isn’t the greatest feature to me, as I could just go to my explore page and find the same posts.
Regardless of these minor things though, I still use Instagram pretty much every day. 😂 It’d just be nicer if these issues were resolved or taken into account by me writing this.",2018-12-21T16:07:25Z,4,🌼Caitlyn🌼,False,Needs Some Improvement
2002812103,user-reviews,"I am finding it harder to use Instagram with every update. Changes that are being made are unnecessary and feel unnatural to me. I can’t see posts in chronological order, I have “suggestions” on the feed which I go to see ONLY what the people I’m following have been up to. That’s been slightly annoying, but now in the explore feed when I click on one post with the intention to scroll through all the posts suggested to me from various users... instead I’m met with only one users posts, most of which I’m not interested in and it’s annoying to have to go back and click the next picture to see the next meme or what-have-it, causing me to close the app and open FaceBook or Twitter instead as they aren’t making changes that are majorly affecting the way users browse content. I don’t know who instagram has put in charge of these updates, but every single update gets worse. ALSO not to mention, the app will automatically follow accounts that I have either never encountered or had no interest in following. I have never left a review in the AppStore but Instagram used to be my favorite social media outlet and now I’m much more fond of other things due to some of the updates and I think a lot of people might feel this way about the path instagram is taking.",2017-12-17T05:24:44Z,3,Aperralll,False,Please stop making unnecessary changes
6363662798,user-reviews,"I love Instagram, it’s like a more modern version of Facebook thats basic enough for my grandma to understand but still fun for me to use. However I don’t know if this is a fluke or apart of the update. A message came up saying Instagram limits how much likes we can do on comments at a time to stop bullying... I just want to know who thought this was a good idea. This is a social media app that’s like the whole point, liking is literally the foundation of every media. If you have a limit whether your intentions are bad or not your going to end up being wiped for existence. And also I don’t know who thought a limit on liking comments would prevent bullying but that person has obviously never really been bullied in their entire life because that does nothing. The only thing limiting likes is going to do is leave Instagram with bad rating and have your audience delete the app and go to another platform that allows them to do what social media is suppose to be able to do. Speaking of such I won’t delete the app yet because I’m hoping this is a fluke but I will be switching to another platform, for the rest of the month, that is able to do its job. I appreciate the concern for bullying but find a way to help prevent it that doesn’t effect everyone and take away from the purpose of social media.",2020-08-26T17:23:40Z,3,Eurasia☺️,False,New Update
2669572461,user-reviews,"I really enjoy using Instagram but I have one issue and that is that when I try to upload more than one photo into one post it crops my photos to the same size as the first one in the post. I want to be able to post all of them into one post and have all of the pictures be the original size. This would be great for photographers like me who go out on photoshoots and want to put up one post with their best photos. It is hard to do that when all of your photos are cropped the exact same way. It should be the same way as Facebook. I am not saying we make Instagram exactly like Facebook because they are two different social medias, but I think it would be nice if we could upload photos on Instagram the same way we can upload them on Facebook. With Facebook you have one post with multiple pictures that are all the original sizes. You can then click on them and look through them individually before exiting and going through the rest of your feed. Instagram should allow us to have the option to upload our photos like this. We should have an option to do this If we have a photography account. I know not everyone would want to upload their photos this way but many would choose to do this.",2018-06-10T04:41:41Z,4,--wolfg1rl--,False,Fix this please!
3601569808,user-reviews,"My Instagram feed is now filled with posts from advertisers and accounts of which I don’t even follow. I never see my friends on my feed anymore unless I am scrolling for 10 minutes and people’s pictures are not getting as many likes. I can speak from experience because I have watched my likes go down as Instagram has changed their algorithm. People like things which are unique! Keep Instagram different and unique and make other platforms want to be like you, not you wanting to be like them. If the changes are based off of Statistics, realize the functions of other apps. Snapchat for instance, people like it simply because it is very private. On Instagram you are able to send pictures to people however they can be uploaded from the camera roll and used to look like the picture was taken just then.. this makes Instagram very user friendly for catfishes. Just keep the traditional Instagram aspects and forget about conformity. Make it so dm pictures- if uploaded from camera roll, it states that. Additionally, make the feed tendered to followers which a users look at most frequently.

Because of these issues with the algorithm, even though I used Instagram since 2012, I must say goodbye until changes are made :(",2019-01-02T02:34:27Z,4,uzer001098876,False,A sad user
6711104451,user-reviews,"Ive been on instagram since it came out okay, I’ve been through all of the updates. I can deal with changes to layout, and bugs. What i can’t deal with is feeling like i am being thrown into what feels like a money making business. I understand you want to make money, but instagram originally was a platform to share photos and videos that’s it. I like to think of it as my digital journal, but now it feels like a task to even navigate and find posts that I genuinely want to see. Consider that maybe not everyone wants to be invaded with things to buy even if it is targeted to us, it is unecessary because if we truly need a product we know exactly where to get it without the need of Instagram invading our experience. Instead of cultivating posts you think I would like, leave it up to me the human to make those decisions. I like to think for myself. And what’s up with changing the chronological order of posts? What sense does it make to cycle in and out older posts from users. It is not useful, people like to feel in control. Instagram used to be a cool platform to literally EXPRESS and only that! You try too hard to fit in Instagram, stay original that was your best quality. Make changes and listen to your users, were the ones that keep you alive. We’ve got tired of apps before, don’t be the next one.",2020-12-03T00:23:11Z,2,ciboneyolmsted,False,You are losing long time users
4155161368,user-reviews,"Made a great account and was gaining a lot of followers but only ended up having it for 6 days because Instagram banned it. I had 600 hundred followers and was averaging 100 followers gained a day. The first thing they did to my account was make it unable to comment but that was understandable I guess because I was commenting a lot. They then lifted this after one day. I started posting again and realized my hashtags didn’t work because now they shadow banned me because (and I’m guessing) they believed my account was a bot. This got me mad but my account was still thriving so I did not care. They than started deleting some of my post claiming it went against their guidelines which I read later on and saw that it didn’t.i also made a promotion with one of my vids and had no problems and the next time I tried doing it with the same vid They said it went against there ad policy. Yesterday at 9p.m I went to check how many followers I had before I went to sleep and saw that they had banned my account all together with no warnings what so ever. They didn’t give me a chance to do anything. Today I also realized every account on my phone is shadow banned and I cant create any accounts anymore so yea long story short Instagram screwed me over and is the worst social app to date. Thanks a lot
EDIT: I’m now logged out of Instagram and can’t sign in to any account or make a new one and I’m not banned on those accounts",2019-05-15T18:29:22Z,1,yallwallin,False,Worst experience ever
6947657180,user-reviews,I literally don’t know what to do anymore. Someone’s pretending to be me I try filling in the form attached my ID I even tried through the computer and it’s saying they can’t “process my request”  I tried other ways to report it to them by reporting a specific photo cause the profile photo they have of me is the same at the photo they uploaded I sent the report EXPLAINING THAT THEIR FORM ISNT WORKING sending the photo so they can see and my photo to confirm that I’m the one in the photo.... they replied saying they can’t process my report cause I sent too many pictures they ask me to sent a picture of just me holding my Id. The only thing they did was take down the photo the fake account uploaded!!! They literally had one job... like don’t you see my ID has the same name of the account ? And the photo uploaded is the same as the profile picture? That makes no sense. I heard you can get an account deleted if you have about 15 people to report it... that didn’t work either... mind you I don’t even have a personal Instagram anymore I deleted it due to this person trying to do me harm... I have no idea what to do. I already tried reporting the issue “somethings not working” to them and after submitting it little 30 seconds after it says I need to tap to re try uploading my report cause it’s not going through... please can someone help me with this... I feel so unsafe !,2021-02-03T07:12:15Z,1,Lizzy687lopes,False,PLEASE FIX YOUR FILL OUT FORMS ! THEY DONT PROCESS!! I DONT FEEL SAFE
6365565800,user-reviews,"First of I don’t like how if you have a really good quality picture instagram ruins the quality! THIS NEEDS TO BE FIXED RIGHT AWAY! US POSTING A PICTURE SHOULDN'T RUIN THE QUALITY OF THE POST! Second I don’t like how some people’s instagrams have different stuff than others. Like how for some people their can choose to color their messages and some can’t. It’s really unfair to others that don’t even have the option. The same thing goes with the bouncing text letter thing. Some people are able to move the text and it like wiggles and stiff while others do not have that option. Also it took so long for everyone to get the option to be able to share a post to your story. I remember i went years without having the option to share posts to your story, even after i sent many reports to instagram about this. So of course I was super happy when I FINALLY had the option. I have no clue why it took them sooo long to fix that when so many people were reporting that. Anyway I hope this helps and I hope instagram gets faster at fixing their bugs and make sure everyone’s instagrams are fair. Like have the same options and stuff. That’s it for now! 0w0",2020-08-27T06:46:32Z,5,Millysmiles10,False,some things need to be fixed.....
6884822314,user-reviews,"Instagram has been horrible. I try to contact them through the help forms almost on the daily because of bugs and glitches that still haven't been fixed. I first want to talk about the image quality. It is a KNOWN Issue and has been for a while now. It should have been fixed long time ago. Second is all the glitches. I cant even count the times I have reported the same things over and over again. With no help of response back. If you dont care about your consumers just say it. Ive had to even google help forms to try to resolve the issue and there are hundreds of people with the same issue as me.. and guess what? No help from Instagram. On the daily it kicks me out of my account, tells me to verify, and change my password. Ive changed my password 20 TIMES in 2 months. I dont know how much verification you need. Ive even linked a tumblr and facebook to my account. Like it’s frustrating. Then a new thing is the “try again later glitch” pops up every day and doesn’t let me see any of my followers list or other people’s follower list. I get action blocked when all I do is look at stories and posts! Like what? I might like a photo or two but nothing to get action blocked. At this point if you want to grow on a playform. Instagram isnt the place. They care more about the shop feature then actually people.",2021-01-18T14:56:22Z,2,LaurenPixie1,False,Downgrades by the day.
4033307040,user-reviews,Hey so I am a tattoo artist and I use Instagram basically to contact and find new clientele. Over the last two years with Instagram I have had amazing results. Unfortunately over the last week I've been having a lot of problems. Accounts that aren't following me and a lot of my followers aren't seeing my new posts they said I was always on there different hashtags they follow and now I'm not also my posts have drastically went down in likes and all my likes are from my followers no new accounts which is very different then the previous weeks and months . I also have been putting out way more content and it's better so my interactions and likes and followers should go up like they have been but for some reason all of the sudden no one is seeing me finding me and like I said even my followers keep telling me the can't see my posts. I love Instagram it's been an amazing platform to grow and literally is the a third of the reason I am successful and I can support my daughter and wife but I've had a huge drop recently and it's hurt my business and I'm sure it's an easy fix or there's a way to make it better or something but it definitely is upsetting at the moment.,2019-04-19T16:05:08Z,5,Ben609tattoo,False,Problems right now
4963421161,user-reviews,"I’ve had instagram since I can honestly remember and I’ve always loved it. But recently I have started an art account and it was going smoothly the first probably 7 months until Instagram updated and now no one sees my posts. I’m not gaining followers because my posts aren’t recommended because IM NOT A BIG ACCOUNT. It honestly irks me to see how my hard work to draw and post almost every day is now basically all for nothing because everything is being handed to the bigger accounts. Smaller accounts are now butted to the side and ignored. There is almost no was of growing. I use hashtags, my story, and I posted regularly— yet my numbers still decreased with the new update. I feel like it is their way of saying “don’t promote? Don’t grow.” Sorry but not everyone is able to pay for that mess. I just wish everything was fair like it used to be. Why do big app developers always ruin something that was going so good? How can anyone else make it when they aren’t given the chances the bigger accounts once were given?

Please, backtrack and return it to how it used to be. I’ve had many other artists also complain and get discouraged because they feel the same way. It may seem like a problem only social media addicted teens would complain about but when you are trying to get out there and get known so that maybe you can have a career out of it, it’s a kick to the gut.",2019-10-18T03:17:35Z,1,nacephus,False,It was great and now no one sees my posts
4537427915,user-reviews,"Instagram is a great app that I use on a daily basis, I love it and i’ve had it multiple years, but there are some changes that would make this app go above and beyond that me, and many others, would appreciate. First off, after you post multiple pictures in one post, you should be able to delete some pictures out of the post without having to delete the whole post. This would make so many users more happy because there are countless times when you accidentally post one picture in a group of pictures that you don’t like, but you didn’t realize it in time and you already have many likes and comments so you don’t want to delete the whole post and you just stay stuck on what to do. Also, if you creators made a way to preview certain pictures on a private account that the creator of the account puts up that would be amazing! It’s difficult to tell who some people are sometimes when you are only able see their profile pic so if you were able to select a few pictures from camera roll to put up (no likes or comments involved) it would be a huge help.

 Thank you creators for the amazing app:) 
                                                            ~Kailee",2019-07-29T15:08:26Z,4,Blobycorn101,False,"great app, some changes would be amazing:)"
